<?xml version="1.0" encoding="UTF-8"?>
<Clientes xmlns:xsi="http://www.w3.org/2001/XMLSchema-instance"
xsi:noNamespaceSchemaLocation="Clientes.xsd">
    <sede codigo ="A7492597">
        <direcciones>
            <direccion>El Prado NÂº39</direccion>
            <direccion> </direccion>
        </direcciones>
        <empleado id="1">
            <nombre>Pepito</nombre>
            <apellido>Perez</apellido>
        </empleado>   
        <fecha_alta>2023-04-07</fecha_alta>
        <descripcion_cliente>solvente</descripcion_cliente>
        <cliente codigoCliente="ABC-743">
            <numero_viv>2</numero_viv> 
            <coste>1000.25</coste>
            <resumen>Se encuentra en buenas condiciones</resumen>
            <plazo>30</plazo>   
        </cliente>
    </sede>
</Clientes>